{
  "report_id": "NW_LS410",
  "location": "Des Moines, IA",
  "date": "2025-12-31",
  "source": "USDA Market News",
  "sections": {
    "national_daily_direct_cattle": {
      "live_steer": {
        "weight": 1578,
        "price": 229.3,
        "head": 20222
      },
      "live_heifer": {
        "weight": 1395,
        "price": 229.34,
        "head": 11959
      }
    }
  }
}